{
  "contact": {
    "name": "Jane Doe",
    "email": "example@email.com",
    "phone": "+1-123-456-7890",
    "location": {
      "city": "Techville",
      "state": "Academia",
      "country": "USA"
    },
    "links": [
      { "uri": "https://linkedin.com/in/janedoe" },
      { "uri": "https://github.com/janedoe" }
    ]
  },
  "skills": {
    "title": "Core Skills",
    "categories": [
      {
        "category": "Programming Languages",
        "items": ["Python", "Java", "C++", "JavaScript"]
      },
      {
        "category": "Tools & Frameworks",
        "items": ["AWS", "Docker", "React", "Node.js"]
      }
    ]
  },
  "experience": {
    "title": "Professional Experience",
    "positions": [
      {
        "company": "Tech Innovations Inc.",
        "title": "Software Developer",
        "highlights": [
          "Developed a cloud-based storage solution improving data retrieval efficiency by 40%.",
          "Collaborated on a team project to create a cross-platform mobile application."
        ],
        "dates": { "start": "2021-07-01T00:00:00Z" },
        "location": { "city": "Techville", "state": "Academia" }
      },
      {
        "company": "FutureSoft",
        "title": "Systems Engineer",
        "highlights": [
          "Implemented a company-wide upgrade of network security protocols, enhancing system security by 50%.",
          "Automated key processes using Python and Bash scripts, saving 200 man-hours annually."
        ],
        "dates": { "start": "2023-01-01T00:00:00Z", "end": "2023-12-31T00:00:00Z" },
        "location": { "city": "Innovation City", "state": "Futuristan" }
      },
      {
        "company": "Innovative Tech Corp",
        "title": "Lead Developer",
        "highlights": [
          "Led the development of a scalable e-commerce platform, increasing user engagement by 30%.",
          "Managed a team of 5 developers and introduced agile delivery practices across the organization."
        ],
        "dates": { "start": "2022-08-01T00:00:00Z", "end": "2022-12-31T00:00:00Z" },
        "location": { "city": "Metropolis", "state": "Innovation State" }
      },
      {
        "company": "NextGen Solutions",
        "title": "Junior Developer",
        "highlights": [
          "Assisted in developing APIs for internal tools, improving workflow efficiency by 25%.",
          "Won second place in a company-wide hackathon with a machine learning project."
        ],
        "dates": { "start": "2020-01-01T00:00:00Z", "end": "2021-06-30T00:00:00Z" },
        "location": { "city": "Future City", "state": "Progress" }
      }
    ]
  },
  "education": {
    "title": "Education",
    "institutions": [
      {
        "institution": "Prestigious University",
        "degree": { "name": "Ph.D. in Computer Science" },
        "dates": { "start": "2021-09-01T00:00:00Z", "end": "2024-05-30T00:00:00Z" },
        "location": { "city": "Techville", "state": "Academia" }
      },
      {
        "institution": "University of Fictional",
        "degree": { "name": "Bachelor of Science in Software Engineering" },
        "dates": { "start": "2017-09-01T00:00:00Z", "end": "2021-06-30T00:00:00Z" },
        "location": { "city": "Imaginary City", "state": "Stateville" }
      }
    ]
  },
  "projects": {
    "title": "Projects",
    "projects": [
      {
        "name": "Personal Finance Tracker",
        "highlights": [
          "Developed a full-stack web application for personal finance management with budgeting and forecasting tools."
        ],
        "link": { "uri": "https://github.com/janedoe/finance-tracker" }
      },
      {
        "name": "Eco-Friendly Route Finder",
        "highlights": [
          "Created a mobile application that calculates eco-friendly travel routes to reduce carbon footprint."
        ],
        "link": { "uri": "https://github.com/janedoe/eco-route-finder" }
      }
    ]
  }
}
